{
  "issue_number": 9429,
  "iterations": 15,
  "library_coverage": {
    "instruction": {
      "covered": 67978,
      "ratio": 0.2910291208932348,
      "total": 233578
    },
    "line": {
      "covered": 13081,
      "ratio": 0.39405350042173753,
      "total": 33196
    },
    "method": {
      "covered": 2043,
      "ratio": 0.46389645776566757,
      "total": 4404
    }
  },
  "removed": [],
  "timestamp": "2026-10-18T15:41:04+00:00",
  "tokens": {
    "cache_write_input": 1186996,
    "cached_input": 16566232,
    "input": 518,
    "output": 259714
  }
}
